"","characteristic","n_lock1","percent_lock1","n_all","percent_all"
"1",NA,NA,NA,450,0.205677616333545
"2","employed full-time (34 hours or more)",2669,37.2141662018963,78933,36.0772250890127
"3","employed part-time (less than 34 hours)",1111,15.4907975460123,30406,13.8974080049728
"4","full-time parent, homemaker",252,3.51366424986057,9447,4.31785875889556
"5","long-term sick or disabled",261,3.63915225878416,10516,4.80645736303013
"6","retired",1761,24.5538204127161,54437,24.8810497785538
"7","self employed",589,8.21249302844395,14338,6.55334591775638
"8","student/pupil",198,2.76073619631902,7320,3.34568922569233
"9","unemployed and not looking for a job",112,1.56162855549359,4315,1.97221980995388
"10","unemployed but looking for a job",219,3.05354155047407,8627,3.94306843579888
"11","Administrative associate professionals",263,3.6670384829894,4418,2.01929713102578
"12","Advertising and public relations department managers",25,0.348577802565533,236,0.107866483232704
"13","Agricultural, fishery and related labourers",66,0.920245398773006,472,0.215732966465407
"14","Architects, engineers and related professionals not elsewhere classified",68,0.948131622978249,1342,0.613376358043595
"15","Architects, town and traffic planners",7,0.0976017847183491,514,0.234929543989872
"16","Archivists, librarians and related information professionals",54,0.75292805354155,1973,0.901782082280188
"17","Armed forces",41,0.571667596207474,1660,0.758721873585966
"18","Artistic, entertainment and sports associate professionals",71,0.989960959286113,1605,0.733583498256311
"19","Blacksmiths, tool-makers and related trades workers",31,0.43223647518126,361,0.164999154436466
"20","Business professionals",247,3.44394868934746,8468,3.87039567802769
"21","Business services agents and trade brokers",21,0.292805354155047,393,0.179625118264629
"22","Cartographers and surveyors",7,0.0976017847183491,142,0.0649027144874742
"23","Chemical engineers",5,0.0697155605131065,154,0.0703874509230354
"24","Civil engineers",21,0.292805354155047,875,0.399928698426338
"25","Computer associate professionals",36,0.501952035694367,1191,0.544360091229449
"26","Computing professionals",124,1.72894590072504,4947,2.26108259556011
"27","Computing services department managers",29,0.404350250976018,1295,0.59189447367098
"28","Customer services clerks",352,4.9079754601227,12600,5.75897325733926
"29","Customs, tax and related government associate professionals",69,0.96207473508087,1769,0.808541562875647
"30","Directors and chief executives",213,2.96988287785834,4757,2.17424093533039
"31","Electrical and electronic equipment mechanics and fitters",45,0.627440044617959,892,0.407698741710049
"32","Electrical engineers",28,0.390407138873397,938,0.428723564713034
"33","Electronics and telecommunications engineers",27,0.376464026770775,955,0.436493607996746
"34","Extraction and building trades workers",130,1.81260457334077,2726,1.24594929361165
"35","Finance and administration department managers",99,1.38036809815951,3627,1.65776158764837
"36","Finance and sales associate professionals",92,1.28276631344116,2618,1.1965866656916
"37","Food processing and related trades workers",151,2.10540992749582,2564,1.17190535173158
"38","General managers in agriculture, hunting, forestry/ and fishing",2,0.0278862242052426,256,0.117007710625306
"39","General managers in construction",28,0.390407138873397,942,0.430551810191554
"40","General managers in manufacturing",26,0.362520914668154,929,0.424610012386363
"41","General managers in personal care, cleaning and related services",27,0.376464026770775,435,0.198821695789094
"42","General managers in transport, storage and communications",29,0.404350250976018,1016,0.464374351544182
"43","General managers in wholesale and retail trade",64,0.892359174567764,2873,1.31313731494728
"44","General managers not elsewhere classified",128,1.78471834913553,5440,2.48641385078775
"45","General managers of business services",42,0.585610708310095,1955,0.893554977626846
"46","General managers of restaurants and hotels",24,0.334634690462911,1341,0.612919296673964
"47","Handicraft workers in wood, textile, leather and related materials",32,0.446179587283882,539,0.246356078230624
"48","Health professionals (except nursing)",147,2.04963747908533,6469,2.95673000013712
"49","Housekeeping and restaurant services workers",107,1.49191299498048,2766,1.26423174839686
"50","Housewife",120,1.67317345231456,120,0.054847364355612
"51","Labourers in mining, construction, manufacturing and transport",175,2.44004461795873,3575,1.63399439642761
"52","Legal professionals",57,0.794757389849414,1970,0.900410898171297
"53","Legislators and senior officials",40,0.557724484104852,2200,1.00553501318622
"54","Life science and health associate professionals",44,0.613496932515337,299,0.1366613495194
"55","Life science professionals",45,0.627440044617959,2191,1.00142146085955
"56","Looking after the home/unpaid family carer",86,1.19910764082543,4822,2.20394992435634
"57","Machinery mechanics and fitters",59,0.822643614054657,1161,0.530648250140546
"58","Mathematicians, statisticians and related professionals",11,0.153374233128834,949,0.433751239778965
"59","Mechanical engineers",32,0.446179587283882,952,0.435122423887855
"60","Metal moulders, welders, sheet-metal workers, structural - metal preparers, and related trades workers",63,0.878416062465142,1023,0.467573781131593
"61","Mining engineers, metallurgists and related professionals",2,0.0278862242052426,109,0.0498196892896809
"62","Models, salespersons and demonstrators",30,0.418293363078639,513,0.234472482620241
"63","Nursing and midwifery professionals",104,1.45008365867262,4351,1.98867401926057
"64","Office clerks",866,12.0747350808701,30512,13.9458565101536
"65","Optical and electronic equipment operators",7,0.0976017847183491,57,0.0260524980689157
"66","Other department managers not elsewhere classified",70,0.976017847183491,3045,1.39175187052366
"67","Other personal services workers",91,1.26882320133854,2538,1.16002175612119
"68","Pelt, leather and shoemaking trades workers",3,0.0418293363078639,55,0.0251383753296555
"69","Personal care and related workers",105,1.46402677077524,3673,1.67878641065136
"70","Personnel and industrial relations department managers",8,0.11154489682097,895,0.40906992581894
"71","Physical and engineering science technicians",8,0.11154489682097,350,0.159971479370535
"72","Physicists, chemists and related professionals",28,0.390407138873397,1225,0.559900177796873
"73","Plant and machine operators and assemblers",111,1.54768544339097,3192,1.45893989185928
"74","Police inspectors and detectives",27,0.376464026770775,947,0.432837117039705
"75","Potters, glass-makers and related trades workers",2,0.0278862242052426,98,0.0447920142237498
"76","Precision workers in metal and related materials",19,0.264919129949805,252,0.115179465146785
"77","Printing and related trades workers",56,0.780814277746793,1319,0.602863946542102
"78","Production and operations department managers in agriculture, hunting, forestry and fishing",2,0.0278862242052426,221,0.101010562688252
"79","Production and operations department managers in business services",7,0.0976017847183491,357,0.163170908957946
"80","Production and operations department managers in construction",10,0.139431121026213,277,0.126605999387538
"81","Production and operations department managers in manufacturing",33,0.460122699386503,1422,0.649941267614003
"82","Production and operations department managers in personal care, cleaning and related services",7,0.0976017847183491,76,0.0347366640918876
"83","Production and operations department managers in restaurants and hotels",9,0.125488008923592,326,0.149002006499413
"84","Production and operations department managers in transport, storage and communications",19,0.264919129949805,456,0.208419984551326
"85","Production and operations department managers in wholesale and retail trade",15,0.20914668153932,486,0.222131825640229
"86","Production and operations department managers not elsewhere classified",19,0.264919129949805,680,0.310801731348468
"87","Protective services workers",20,0.278862242052426,1196,0.5466453980776
"88","Pupil /Student/ in full time education",122,1.7010596765198,5541,2.53257704912039
"89","Religious associate professionals",10,0.139431121026213,231,0.105581176384553
"90","Religious professionals",3,0.0418293363078639,282,0.128891306235688
"91","Research and development department managers",7,0.0976017847183491,340,0.155400865674234
"92","Safety and quality inspectors",17,0.237032905744562,390,0.178253934155739
"93","Sales and marketing department managers",45,0.627440044617959,1646,0.752323014411145
"94","Sales and services elementary occupations",325,4.53151143335192,8987,4.10761052886571
"95","Ship and aircraft controllers and technicians",10,0.139431121026213,185,0.0845563533815685
"96","Skilled agricultural and fishery workers",54,0.75292805354155,1637,0.748209462084474
"97","Social science and related professionals",51,0.711098717233687,1877,0.857904190795698
"98","Social work associate professionals",91,1.26882320133854,2503,1.14402460818414
"99","Supply and distribution department managers",12,0.167317345231456,439,0.200649941267614
"100","Teaching associate professionals",89,1.2409369771333,1257,0.574526141625036
"101","Teaching professionals",445,6.20468488566648,14209,6.49438500107409
"102","Textile, garment and related trades workers",59,0.822643614054657,1117,0.510537549876822
"103","Travel attendants and related workers",59,0.822643614054657,1074,0.490883910982728
"104","Unemployed and not looking for a job / Long-term sick or disabled",285,3.97378694924707,7426,3.39413773087312
"105","Wood treaters, cabinet-makers and related trades workers",39,0.543781372002231,780,0.356507868311478
"106","Writers and creative or performing artists",61,0.8505298382599,2525,1.154079958316
"107","0",0,0,1,0.0004570613696301
"108","0-4",0,0,78,0.0356507868311478
"109","12-17",0,0,197,0.0900410898171297
"110","18-19",0,0,7,0.0031994295874107
"111","18-29",877,12.2281093139989,29265,13.3759009822249
"112","25-34",0,0,2,0.0009141227392602
"113","30-39",1130,15.7557166759621,34944,15.9715525003542
"114","35-44",0,0,1,0.0004570613696301
"115","40-49",1281,17.8611266034579,36281,16.5826435515497
"116","45-54",0,0,1,0.0004570613696301
"117","5-11",0,0,161,0.0735868805104461
"118","50-59",1360,18.962632459565,43274,19.778873709373
"119","60-69",1563,21.7930842163971,47093,21.5243910799903
"120","70-120",961,13.3993307306191,27482,12.5609605601744
"121","Under 1",0,0,2,0.0009141227392602
